{
  "generated_at": "2026-07-21T20:41:16",
  "count": 13,
  "average_score": 74.8,
  "ready_count": 0,
  "needs_curation_count": 13,
  "level_counts": {
    "triage": 3,
    "usable": 10
  },
  "field_gap_counts": {
    "domains": 3,
    "has_code": 4,
    "importance": 1,
    "line_role": 2,
    "methods": 1,
    "next_review": 13,
    "problems": 3,
    "reading_stage": 3,
    "research_line": 2,
    "review_stage": 13,
    "tracks": 3
  },
  "weak_field_counts": {
    "domains": 9,
    "problems": 8,
    "topics": 1,
    "tracks": 3
  },
  "field_contract": [
    {
      "field": "research_line",
      "label": "研究线",
      "weight": 15,
      "kind": "taxonomy",
      "patch_column": "research_line"
    },
    {
      "field": "line_role",
      "label": "研究角色",
      "weight": 8,
      "kind": "taxonomy",
      "patch_column": "line_role"
    },
    {
      "field": "domains",
      "label": "Domain",
      "weight": 8,
      "kind": "taxonomy_list",
      "patch_column": "domains"
    },
    {
      "field": "tracks",
      "label": "Track",
      "weight": 8,
      "kind": "taxonomy_list",
      "patch_column": "tracks"
    },
    {
      "field": "problems",
      "label": "Problem",
      "weight": 8,
      "kind": "taxonomy_list",
      "patch_column": "problems"
    },
    {
      "field": "topics",
      "label": "Topic",
      "weight": 8,
      "kind": "taxonomy_list",
      "patch_column": "topics"
    },
    {
      "field": "methods",
      "label": "Method",
      "weight": 8,
      "kind": "taxonomy_list",
      "patch_column": "methods"
    },
    {
      "field": "status",
      "label": "状态",
      "weight": 8,
      "kind": "workflow",
      "patch_column": "status"
    },
    {
      "field": "reading_stage",
      "label": "阅读阶段",
      "weight": 7,
      "kind": "workflow",
      "patch_column": "reading_stage"
    },
    {
      "field": "review_stage",
      "label": "复习阶段",
      "weight": 6,
      "kind": "workflow",
      "patch_column": "review_stage"
    },
    {
      "field": "importance",
      "label": "重要性",
      "weight": 5,
      "kind": "priority",
      "patch_column": "importance"
    },
    {
      "field": "next_review",
      "label": "下次复习",
      "weight": 6,
      "kind": "review",
      "patch_column": "next_review"
    },
    {
      "field": "has_code",
      "label": "代码状态",
      "weight": 5,
      "kind": "evidence",
      "patch_column": "has_code"
    }
  ],
  "papers": [
    {
      "slug": "semantic-search-evaluation",
      "title": "Semantic Search Evaluation",
      "title_zh": "Semantic Search Evaluation",
      "href": "semantic-search-evaluation.md",
      "year": "",
      "research_line": "Unassigned",
      "line_role": "",
      "status": "read",
      "reading_stage": "",
      "review_stage": "",
      "importance": "",
      "score": 16,
      "level": "triage",
      "missing_fields": [
        "research_line",
        "line_role",
        "domains",
        "tracks",
        "problems",
        "methods",
        "reading_stage",
        "review_stage",
        "importance",
        "next_review",
        "has_code"
      ],
      "weak_fields": [
        "topics"
      ],
      "field_status": {
        "research_line": {
          "present": false,
          "count": 0,
          "weight": 15
        },
        "line_role": {
          "present": false,
          "count": 0,
          "weight": 8
        },
        "domains": {
          "present": false,
          "count": 0,
          "weight": 8
        },
        "tracks": {
          "present": false,
          "count": 0,
          "weight": 8
        },
        "problems": {
          "present": false,
          "count": 0,
          "weight": 8
        },
        "topics": {
          "present": true,
          "count": 1,
          "weight": 8
        },
        "methods": {
          "present": false,
          "count": 0,
          "weight": 8
        },
        "status": {
          "present": true,
          "count": 1,
          "weight": 8
        },
        "reading_stage": {
          "present": false,
          "count": 0,
          "weight": 7
        },
        "review_stage": {
          "present": false,
          "count": 0,
          "weight": 6
        },
        "importance": {
          "present": false,
          "count": 0,
          "weight": 5
        },
        "next_review": {
          "present": false,
          "count": 0,
          "weight": 6
        },
        "has_code": {
          "present": false,
          "count": 0,
          "weight": 5
        }
      },
      "patch_columns": [
        "slug",
        "research_line",
        "line_role",
        "domains",
        "tracks",
        "problems",
        "methods",
        "reading_stage",
        "review_stage",
        "importance",
        "next_review",
        "has_code",
        "topics"
      ],
      "actions": [
        "补齐缺失 frontmatter 字段",
        "扩充稀疏 taxonomy 标签",
        "安排复习日期",
        "补充代码实现观察或标记无代码"
      ],
      "recommendation": "优先补齐研究线与结构分类，让论文进入正确的长期知识架构。"
    },
    {
      "slug": "2603.03251-speculative-speculative-decoding",
      "title": "Speculative Speculative Decoding",
      "title_zh": "推测性推测解码",
      "href": "2603.03251-speculative-speculative-decoding.html",
      "year": 2026,
      "research_line": "Unassigned",
      "line_role": "",
      "status": "read",
      "reading_stage": "",
      "review_stage": "",
      "importance": 4,
      "score": 34,
      "level": "triage",
      "missing_fields": [
        "research_line",
        "line_role",
        "domains",
        "tracks",
        "problems",
        "reading_stage",
        "review_stage",
        "next_review"
      ],
      "weak_fields": [],
      "field_status": {
        "research_line": {
          "present": false,
          "count": 0,
          "weight": 15
        },
        "line_role": {
          "present": false,
          "count": 0,
          "weight": 8
        },
        "domains": {
          "present": false,
          "count": 0,
          "weight": 8
        },
        "tracks": {
          "present": false,
          "count": 0,
          "weight": 8
        },
        "problems": {
          "present": false,
          "count": 0,
          "weight": 8
        },
        "topics": {
          "present": true,
          "count": 4,
          "weight": 8
        },
        "methods": {
          "present": true,
          "count": 6,
          "weight": 8
        },
        "status": {
          "present": true,
          "count": 1,
          "weight": 8
        },
        "reading_stage": {
          "present": false,
          "count": 0,
          "weight": 7
        },
        "review_stage": {
          "present": false,
          "count": 0,
          "weight": 6
        },
        "importance": {
          "present": true,
          "count": 1,
          "weight": 5
        },
        "next_review": {
          "present": false,
          "count": 0,
          "weight": 6
        },
        "has_code": {
          "present": true,
          "count": 1,
          "weight": 5
        }
      },
      "patch_columns": [
        "slug",
        "research_line",
        "line_role",
        "domains",
        "tracks",
        "problems",
        "reading_stage",
        "review_stage",
        "next_review"
      ],
      "actions": [
        "补齐缺失 frontmatter 字段",
        "安排复习日期"
      ],
      "recommendation": "优先补齐研究线与结构分类，让论文进入正确的长期知识架构。"
    },
    {
      "slug": "2512.23424-akg-kernel-agent-multi",
      "title": "AKG kernel Agent: A Multi-Agent Framework for Cross-Platform Kernel Synthesis",
      "title_zh": "AKG kernel Agent：用于跨平台 Kernel 合成的多智能体框架",
      "href": "2512.23424-akg-kernel-agent-multi.html",
      "year": 2025,
      "research_line": "LLM Serving",
      "line_role": "tooling",
      "status": "read",
      "reading_stage": "",
      "review_stage": "",
      "importance": 4,
      "score": 52,
      "level": "triage",
      "missing_fields": [
        "domains",
        "tracks",
        "problems",
        "reading_stage",
        "review_stage",
        "next_review",
        "has_code"
      ],
      "weak_fields": [],
      "field_status": {
        "research_line": {
          "present": true,
          "count": 1,
          "weight": 15
        },
        "line_role": {
          "present": true,
          "count": 1,
          "weight": 8
        },
        "domains": {
          "present": false,
          "count": 0,
          "weight": 8
        },
        "tracks": {
          "present": false,
          "count": 0,
          "weight": 8
        },
        "problems": {
          "present": false,
          "count": 0,
          "weight": 8
        },
        "topics": {
          "present": true,
          "count": 5,
          "weight": 8
        },
        "methods": {
          "present": true,
          "count": 6,
          "weight": 8
        },
        "status": {
          "present": true,
          "count": 1,
          "weight": 8
        },
        "reading_stage": {
          "present": false,
          "count": 0,
          "weight": 7
        },
        "review_stage": {
          "present": false,
          "count": 0,
          "weight": 6
        },
        "importance": {
          "present": true,
          "count": 1,
          "weight": 5
        },
        "next_review": {
          "present": false,
          "count": 0,
          "weight": 6
        },
        "has_code": {
          "present": false,
          "count": 0,
          "weight": 5
        }
      },
      "patch_columns": [
        "slug",
        "domains",
        "tracks",
        "problems",
        "reading_stage",
        "review_stage",
        "next_review",
        "has_code"
      ],
      "actions": [
        "补齐缺失 frontmatter 字段",
        "安排复习日期",
        "补充代码实现观察或标记无代码"
      ],